{
  "$schema": "./ross-brand.schema.json",
  "schemaVersion": 1,
  "product": {
    "name": "ROSS",
    "expandedName": "Ranade OSS",
    "tagline": "Ontario-first legal work, built in the open.",
    "description": "A public-registration legal AI workspace in development for Ontario lawyers and paralegals.",
    "betaLabel": "Public beta — verified account required; connected-provider terms and settings apply",
    "legalOperator": "Abhi Ranade",
    "productOwner": "Abhi Ranade",
    "technicalOwner": "AR",
    "legalContentOwner": "AR"
  },
  "urls": {
    "website": "https://ross.soundmarklaw.com",
    "app": "https://ross-ranadeoss-public.fly.dev",
    "api": "https://ross-ranadeoss-api.fly.dev",
    "status": "https://ross.soundmarklaw.com/status",
    "support": "mailto:abhi@soundmarklaw.com",
    "security": "https://github.com/ranade-oss/ROSS-RanadeOSS/security/advisories/new",
    "source": "https://github.com/ranade-oss/ROSS-RanadeOSS",
    "upstreamSource": "https://github.com/Open-Legal-Products/mike",
    "upstreamWebsite": "https://mikeoss.com"
  },
  "identity": {
    "primaryColour": "#102A43",
    "primaryColourName": "ROSS Navy",
    "accentColour": "#0F8B8D",
    "accentColourName": "ROSS Teal",
    "lightColour": "#F4F8FA",
    "textColour": "#102A43",
    "fontStack": "Inter, ui-sans-serif, system-ui, -apple-system, BlinkMacSystemFont, Segoe UI, sans-serif",
    "icon": "brand/assets/ross-icon.svg",
    "wordmark": "brand/assets/ross-wordmark.svg",
    "favicon": "brand/assets/favicon.svg"
  },
  "policy": {
    "defaultJurisdiction": "CA-ON",
    "productionDataResidencyTarget": "Canada",
    "previewData": "provider-responsibility",
    "coverageStatus": "limited-source-reviewed",
    "courtListenerPreserved": true,
    "canliiScrapingAllowed": false,
    "governmentAffiliation": false,
    "trademarkReview": "TBD"
  },
  "attribution": {
    "short": "ROSS is a modified fork of Mike and is licensed under AGPL-3.0.",
    "noticePath": "NOTICE.md"
  },
  "socialLinks": []
}
